[
  {
    "schema_version": "0.1.0",
    "fragment_id": "frag_bendr_profile",
    "multipass_id": "mp_bendr_2",
    "fragment_type": "attestation",
    "status": "verified",
    "assurance_level": "platform_verified",
    "visibility": "public",
    "transfer_policy": "historical_on_transfer",
    "source": {
      "source_type": "platform_check",
      "source_id": "bendr_profile",
      "issuer": "Helixa",
      "observed_at": "2026-06-24T00:00:00Z",
      "reference_url": null
    },
    "public_value": "Bendr 2.0 profile claim checked by the Helixa fixture.",
    "proof_reference": "fixture:profile-check",
    "created_at": "2026-06-24T00:00:00Z",
    "updated_at": "2026-06-24T00:00:00Z",
    "verified_at": "2026-06-24T00:00:00Z"
  },
  {
    "schema_version": "0.1.0",
    "fragment_id": "frag_bendr_endpoint",
    "multipass_id": "mp_bendr_2",
    "fragment_type": "endpoint",
    "status": "pending",
    "assurance_level": "self_attested",
    "visibility": "public",
    "transfer_policy": "reverify_on_transfer",
    "source": {
      "source_type": "owner_submission",
      "source_id": "bendr_endpoint",
      "issuer": null,
      "observed_at": "2026-06-24T00:00:00Z",
      "reference_url": null
    },
    "public_value": "Bendr local API endpoint awaiting live verification.",
    "proof_reference": null,
    "created_at": "2026-06-24T00:00:00Z",
    "updated_at": "2026-06-24T00:00:00Z",
    "endpoint_ref": {
      "endpoint_id": "lookup",
      "url": "http://127.0.0.1:8787/api/multipass/bendr-2",
      "protocol": "api",
      "manifest_url": "http://127.0.0.1:8787/api/multipass/bendr-2/x402"
    }
  },
  {
    "schema_version": "0.1.0",
    "fragment_id": "frag_bendr_standard_ref",
    "multipass_id": "mp_bendr_2",
    "fragment_type": "standard_ref",
    "status": "stale",
    "assurance_level": "issuer_attested",
    "visibility": "public",
    "transfer_policy": "pause_on_transfer",
    "source": {
      "source_type": "issuer_attestation",
      "source_id": "bendr_standard",
      "issuer": "Helixa",
      "observed_at": "2026-06-24T00:00:00Z",
      "reference_url": null
    },
    "public_value": "ERC-8004 adapter reference that needs a fresh check before stronger claims.",
    "proof_reference": "fixture:standard-ref",
    "created_at": "2026-06-24T00:00:00Z",
    "updated_at": "2026-06-24T00:00:00Z",
    "verified_at": "2026-06-24T00:00:00Z",
    "expires_at": "2026-06-25T00:00:00Z"
  },
  {
    "schema_version": "0.1.0",
    "fragment_id": "frag_bendr_receipt_history",
    "multipass_id": "mp_bendr_2",
    "fragment_type": "receipt",
    "status": "historical",
    "assurance_level": "issuer_attested",
    "visibility": "public",
    "transfer_policy": "historical_on_transfer",
    "source": {
      "source_type": "payment_receipt",
      "source_id": "bendr_receipt",
      "issuer": "Helixa",
      "observed_at": "2026-06-24T00:00:00Z",
      "reference_url": null
    },
    "public_value": "Receipt evidence retained as history; it does not create trust by itself.",
    "proof_reference": "receipt_bendr_lookup",
    "created_at": "2026-06-24T00:00:00Z",
    "updated_at": "2026-06-24T00:00:00Z"
  },
  {
    "schema_version": "0.1.0",
    "fragment_id": "frag_bendr_route_dispute",
    "multipass_id": "mp_bendr_2",
    "fragment_type": "verification_result",
    "status": "disputed",
    "assurance_level": "unverified",
    "visibility": "public",
    "transfer_policy": "never_transfer",
    "source": {
      "source_type": "platform_check",
      "source_id": "bendr_route_dispute",
      "issuer": "Helixa",
      "observed_at": "2026-06-24T00:00:00Z",
      "reference_url": null
    },
    "public_value": "Route claim intentionally marked disputed in the fixture.",
    "proof_reference": "fixture:route-dispute",
    "created_at": "2026-06-24T00:00:00Z",
    "updated_at": "2026-06-24T00:00:00Z",
    "verification_ref": {
      "verification_type": "route_review",
      "result": "inconclusive",
      "issuer": "Helixa",
      "risk_level": "medium",
      "score": null
    }
  },
  {
    "schema_version": "0.1.0",
    "fragment_id": "frag_bendr_private_placeholder",
    "multipass_id": "mp_bendr_2",
    "fragment_type": "attestation",
    "status": "pending",
    "assurance_level": "unverified",
    "visibility": "private",
    "transfer_policy": "reverify_on_transfer",
    "source": {
      "source_type": "owner_submission",
      "source_id": "bendr_private",
      "issuer": null,
      "observed_at": "2026-06-24T00:00:00Z",
      "reference_url": null
    },
    "public_value": null,
    "proof_reference": null,
    "created_at": "2026-06-24T00:00:00Z",
    "updated_at": "2026-06-24T00:00:00Z"
  },
  {
    "schema_version": "0.1.0",
    "fragment_id": "frag_bendr_helixa_identity",
    "multipass_id": "mp_bendr_2",
    "fragment_type": "attestation",
    "status": "verified",
    "assurance_level": "onchain_verified",
    "visibility": "public",
    "transfer_policy": "historical_on_transfer",
    "source": {
      "source_type": "contract_read",
      "source_id": "helixa_agentdna_1",
      "issuer": "Helixa",
      "observed_at": "2026-06-24T22:49:52Z",
      "reference_url": "https://api.helixa.xyz/api/v2/agent/1"
    },
    "public_value": "Helixa AgentDNA token #1 on Base, contract 0x2e3B541C59D38b84E3Bc54e977200230A204Fe60.",
    "proof_reference": "base:8453:0x2e3B541C59D38b84E3Bc54e977200230A204Fe60:1",
    "created_at": "2026-06-24T22:49:52Z",
    "updated_at": "2026-06-24T22:49:52Z",
    "verified_at": "2026-06-24T22:49:52Z"
  },
  {
    "schema_version": "0.1.0",
    "fragment_id": "frag_bendr_cred_score",
    "multipass_id": "mp_bendr_2",
    "fragment_type": "risk_summary",
    "status": "verified",
    "assurance_level": "platform_verified",
    "visibility": "public",
    "transfer_policy": "reverify_on_transfer",
    "source": {
      "source_type": "registry_import",
      "source_id": "helixa_cred_score_1",
      "issuer": "Helixa",
      "observed_at": "2026-06-24T22:49:52Z",
      "reference_url": "https://api.helixa.xyz/api/v2/agent/1"
    },
    "public_value": "Cred score 80, Preferred tier, imported from Helixa API.",
    "proof_reference": "helixa-api:agent:1:credScore",
    "created_at": "2026-06-24T22:49:52Z",
    "updated_at": "2026-06-24T22:49:52Z",
    "verified_at": "2026-06-24T22:49:52Z",
    "verification_ref": {
      "verification_type": "cred_import",
      "result": "passed",
      "issuer": "Helixa",
      "risk_level": "low",
      "score": 80
    }
  },
  {
    "schema_version": "0.1.0",
    "fragment_id": "frag_bendr_social_x",
    "multipass_id": "mp_bendr_2",
    "fragment_type": "social",
    "status": "verified",
    "assurance_level": "platform_verified",
    "visibility": "public",
    "transfer_policy": "reverify_on_transfer",
    "source": {
      "source_type": "platform_check",
      "source_id": "bendr_x_handle",
      "issuer": "Helixa",
      "observed_at": "2026-06-24T22:49:52Z",
      "reference_url": "https://api.helixa.xyz/api/v2/agent/1"
    },
    "public_value": "X handle @BendrAI_eth imported from Helixa API.",
    "proof_reference": "helixa-api:agent:1:socials.x",
    "created_at": "2026-06-24T22:49:52Z",
    "updated_at": "2026-06-24T22:49:52Z",
    "verified_at": "2026-06-24T22:49:52Z"
  }
]
