[
  {
    "schema_version": "0.1.0",
    "fragment_id": "frag_demo_wallet",
    "multipass_id": "mp_demo_agent",
    "fragment_type": "wallet",
    "status": "pending",
    "assurance_level": "unverified",
    "visibility": "public",
    "transfer_policy": "reverify_on_transfer",
    "source": {
      "source_type": "owner_submission",
      "source_id": "demo_wallet",
      "issuer": null,
      "observed_at": "2026-06-24T00:00:00Z",
      "reference_url": null
    },
    "public_value": "eip155:8453:0x0000000000000000000000000000000000000000",
    "proof_reference": null,
    "created_at": "2026-06-24T00:00:00Z",
    "updated_at": "2026-06-24T00:00:00Z"
  },
  {
    "schema_version": "0.1.0",
    "fragment_id": "frag_demo_endpoint",
    "multipass_id": "mp_demo_agent",
    "fragment_type": "endpoint",
    "status": "pending",
    "assurance_level": "unverified",
    "visibility": "public",
    "transfer_policy": "reverify_on_transfer",
    "source": {
      "source_type": "owner_submission",
      "source_id": "demo_endpoint",
      "issuer": null,
      "observed_at": "2026-06-24T00:00:00Z",
      "reference_url": null
    },
    "public_value": "Local profile API endpoint.",
    "proof_reference": null,
    "created_at": "2026-06-24T00:00:00Z",
    "updated_at": "2026-06-24T00:00:00Z",
    "endpoint_ref": {
      "endpoint_id": "lookup",
      "url": "http://127.0.0.1:8787/api/multipass/demo-agent",
      "protocol": "api",
      "manifest_url": "http://127.0.0.1:8787/api/multipass/demo-agent/x402"
    }
  },
  {
    "schema_version": "0.1.0",
    "fragment_id": "frag_demo_standard_ref",
    "multipass_id": "mp_demo_agent",
    "fragment_type": "standard_ref",
    "status": "pending",
    "assurance_level": "unverified",
    "visibility": "public",
    "transfer_policy": "reverify_on_transfer",
    "source": {
      "source_type": "owner_submission",
      "source_id": "demo_standard",
      "issuer": null,
      "observed_at": "2026-06-24T00:00:00Z",
      "reference_url": null
    },
    "public_value": "ERC-8004 adapter reference for local demo data.",
    "proof_reference": null,
    "created_at": "2026-06-24T00:00:00Z",
    "updated_at": "2026-06-24T00:00:00Z"
  },
  {
    "schema_version": "0.1.0",
    "fragment_id": "frag_demo_private_note",
    "multipass_id": "mp_demo_agent",
    "fragment_type": "attestation",
    "status": "pending",
    "assurance_level": "unverified",
    "visibility": "private",
    "transfer_policy": "reverify_on_transfer",
    "source": {
      "source_type": "owner_submission",
      "source_id": "demo_private",
      "issuer": null,
      "observed_at": "2026-06-24T00:00:00Z",
      "reference_url": null
    },
    "public_value": null,
    "proof_reference": null,
    "created_at": "2026-06-24T00:00:00Z",
    "updated_at": "2026-06-24T00:00:00Z"
  }
]
